{
  "schema_version": "1.0",
  "period": {
    "current_period": "2099-01",
    "previous_period": "2098-12",
    "timezone": "Europe/Madrid",
    "target_post_count": 20,
    "analysis_window": {
      "start_date": "2098-12-01",
      "end_date": "2098-12-31"
    }
  },
  "business_context": {
    "current_marketing_objective": "Acquire early adopter users for Innerbloom 2.0 with lightweight, measurable social content. The system should minimize manual marketing operations while keeping final approval under human control.",
    "product_stage": "early-stage MVP",
    "audience": [],
    "current_priorities": [
      "This is the first real monthly plan once draft generation is wired.",
      "Planned mix:",
      "8 pain/friction posts: streak pressure, perfect-day planning, restarting from zero, habits collapsing during messy weeks.",
      "5 product mechanism/demo posts: adaptive rhythm, weekly recalibration, dashboard progress, task intensity, visible momentum.",
      "4 belief/differentiation posts: real weeks over perfect calendars, progress without shame, sustainable habit design, anti-all-or-nothing routines.",
      "3 early-adopter CTA posts: try the early version, help shape the product, give feedback after using the dashboard.",
      "Creative rules:",
      "Prefer real Innerbloom 2.0 screenshots over generic lifestyle imagery.",
      "Use both dark-mode and light-mode product assets when available.",
      "Keep carousel slides readable on mobile.",
      "Use R2 URLs in Metricool CSV output.",
      "Store source assets and planning context in Google Drive for browsing.",
      "Measurement:",
      "Primary acquisition: landing views and CTA events from UTM-tagged links.",
      "Primary activation: `auth_started -> auth_completed -> dashboard_view`.",
      "Product-interest proxy: views of `/innerbloom2/dashboard`, `/innerbloom2/tareas`, `/innerbloom2/task-detail`, and `/innerbloom2/logros`.",
      "GA4 active users are anonymous, cookie/device-based users. They are not the same as registered users in Neon.",
      "For marketing decisions:",
      "Treat landing page views as acquisition signal.",
      "Treat `/innerbloom2/...` pages as product usage signal.",
      "Exclude auth redirects such as `accounts.google.com`.",
      "Exclude internal/admin emails before reading registered-user growth.",
      "Search Console is sparse until Google has more impressions.",
      "This is the first real monthly plan once draft generation is wired.",
      "Planned mix:",
      "8 pain/friction posts: streak pressure, perfect-day planning, restarting from zero, habits collapsing during messy weeks.",
      "5 product mechanism/demo posts: adaptive rhythm, weekly recalibration, dashboard progress, task intensity, visible momentum.",
      "4 belief/differentiation posts: real weeks over perfect calendars, progress without shame, sustainable habit design, anti-all-or-nothing routines.",
      "3 early-adopter CTA posts: try the early version, help shape the product, give feedback after using the dashboard.",
      "Creative rules:",
      "Prefer real Innerbloom 2.0 screenshots over generic lifestyle imagery.",
      "Use both dark-mode and light-mode product assets when available.",
      "Keep carousel slides readable on mobile.",
      "Use R2 URLs in Metricool CSV output.",
      "Store source assets and planning context in Google Drive for browsing.",
      "Measurement:",
      "Primary acquisition: landing views and CTA events from UTM-tagged links.",
      "Primary activation: `auth_started -> auth_completed -> dashboard_view`.",
      "Product-interest proxy: views of `/innerbloom2/dashboard`, `/innerbloom2/tareas`, `/innerbloom2/task-detail`, and `/innerbloom2/logros`.",
      "For the next monthly run:",
      "Keep the number of configurable knobs small.",
      "Prefer strong hooks and measurable hypotheses over generic motivational posts.",
      "Reuse visual patterns that remain readable on mobile.",
      "Generate only new visuals when the existing asset library cannot support the post.",
      "Preserve every decision and result in this strategy memory."
    ],
    "constraints": [
      "Approved posts are exported to Metricool CSV; this exporter does not publish content.",
      "Public marketing files can be served from R2 or repository public assets; this exporter does not upload binaries.",
      "Human review is required before publishing.",
      "Do not include secrets, service account keys, unnecessary PII, or individual user identifiers."
    ],
    "known_product_changes": [
      "Metricool CSV import works.",
      "Metricool can ingest image URLs from Cloudflare R2 URLs.",
      "Instagram posts published successfully from the generated CSV.",
      "Cloudflare R2 is now the publishing asset store for CSV exports.",
      "Google Drive remains the human-readable marketing library.",
      "GA4 and Search Console snapshots can be synced into Neon and shown in `/admin/marketing`."
    ],
    "notes": [
      "No explicit audience section found in strategy memory or structured configuration."
    ]
  },
  "strategy_memory": {
    "document_path": "Docs/marketing/strategy-memory.md",
    "current_objective": "Acquire early adopter users for Innerbloom 2.0 with lightweight, measurable social content. The system should minimize manual marketing operations while keeping final approval under human control.",
    "current_positioning": [
      "Innerbloom helps people build sustainable habits that adapt to real life instead of forcing rigid streaks or perfect-day productivity.",
      "Core message:",
      "adaptive habits",
      "real-life rhythm",
      "recalibration instead of restart",
      "visible progress without perfection pressure",
      "early product, feedback welcome"
    ],
    "historical_learnings": [
      "The first operational MVP proved that:",
      "Metricool CSV import works.",
      "Metricool can ingest image URLs from Cloudflare R2 URLs.",
      "Instagram posts published successfully from the generated CSV.",
      "Cloudflare R2 is now the publishing asset store for CSV exports.",
      "Google Drive remains the human-readable marketing library.",
      "GA4 and Search Console snapshots can be synced into Neon and shown in `/admin/marketing`.",
      "The first content batch was only a technical proof. Its performance should not be treated as a strategic signal yet."
    ],
    "previous_experiments": [
      "This is the first real monthly plan once draft generation is wired.",
      "Planned mix:",
      "8 pain/friction posts: streak pressure, perfect-day planning, restarting from zero, habits collapsing during messy weeks.",
      "5 product mechanism/demo posts: adaptive rhythm, weekly recalibration, dashboard progress, task intensity, visible momentum.",
      "4 belief/differentiation posts: real weeks over perfect calendars, progress without shame, sustainable habit design, anti-all-or-nothing routines.",
      "3 early-adopter CTA posts: try the early version, help shape the product, give feedback after using the dashboard.",
      "Creative rules:",
      "Prefer real Innerbloom 2.0 screenshots over generic lifestyle imagery.",
      "Use both dark-mode and light-mode product assets when available.",
      "Keep carousel slides readable on mobile.",
      "Use R2 URLs in Metricool CSV output.",
      "Store source assets and planning context in Google Drive for browsing.",
      "Measurement:",
      "Primary acquisition: landing views and CTA events from UTM-tagged links.",
      "Primary activation: `auth_started -> auth_completed -> dashboard_view`.",
      "Product-interest proxy: views of `/innerbloom2/dashboard`, `/innerbloom2/tareas`, `/innerbloom2/task-detail`, and `/innerbloom2/logros`."
    ],
    "previous_decisions": [
      "For the next monthly run:",
      "Keep the number of configurable knobs small.",
      "Prefer strong hooks and measurable hypotheses over generic motivational posts.",
      "Reuse visual patterns that remain readable on mobile.",
      "Generate only new visuals when the existing asset library cannot support the post.",
      "Preserve every decision and result in this strategy memory."
    ],
    "content_rules": [
      "GA4 active users are anonymous, cookie/device-based users. They are not the same as registered users in Neon.",
      "For marketing decisions:",
      "Treat landing page views as acquisition signal.",
      "Treat `/innerbloom2/...` pages as product usage signal.",
      "Exclude auth redirects such as `accounts.google.com`.",
      "Exclude internal/admin emails before reading registered-user growth.",
      "Search Console is sparse until Google has more impressions.",
      "This is the first real monthly plan once draft generation is wired.",
      "Planned mix:",
      "8 pain/friction posts: streak pressure, perfect-day planning, restarting from zero, habits collapsing during messy weeks.",
      "5 product mechanism/demo posts: adaptive rhythm, weekly recalibration, dashboard progress, task intensity, visible momentum.",
      "4 belief/differentiation posts: real weeks over perfect calendars, progress without shame, sustainable habit design, anti-all-or-nothing routines.",
      "3 early-adopter CTA posts: try the early version, help shape the product, give feedback after using the dashboard.",
      "Creative rules:",
      "Prefer real Innerbloom 2.0 screenshots over generic lifestyle imagery.",
      "Use both dark-mode and light-mode product assets when available.",
      "Keep carousel slides readable on mobile.",
      "Use R2 URLs in Metricool CSV output.",
      "Store source assets and planning context in Google Drive for browsing.",
      "Measurement:",
      "Primary acquisition: landing views and CTA events from UTM-tagged links.",
      "Primary activation: `auth_started -> auth_completed -> dashboard_view`.",